{
	"$schema": "./schema.json",
	"error.requiredField": "Required field",
	"error.unexpected": "An unexpected error occurred. Please try again later or contact the support team.",
	"signin.title": "Sign in",
	"signin.username.label": "Username",
	"signin.username.placeholder": "Enter your username",
	"signin.password.label": "Password",
	"signin.password.placeholder": "Enter your password",
	"signin.button": "Sign in",
	"signin.error.incorrectCredentials": "Invalid credentials. Either the username or password are incorrect.",
	"sidebar.dashboard": "Dashboard",
	"sidebar.map": "Map",
	"sidebar.routes": "Routes",
	"sidebar.containers": "Containers",
	"sidebar.warehouses": "Warehouses",
	"sidebar.trucks": "Trucks",
	"sidebar.reports": "Reports",
	"sidebar.employees": "Employees",
	"notFound.title": "Page not found",
	"notFound.description": "The page you are looking for does not exist.",
	"forbidden.title": "Access forbidden",
	"forbidden.description": "You do not have permission to access this page.",
	"map.layers": "Layers",
	"employees.title": "Employees",
	"employees.addEmployee": "Add new employee",
	"employees.search": "Search by name",
	"employees.save": "Save",
	"employees.cancel": "Cancel",
	"employees.personalInfo": "Personal information",
	"employees.firstName": "First Name",
	"employees.lastName": "Last Name",
	"employees.username": "Username",
	"employees.birthdate": "Birthdate",
	"employees.location": "Location",
	"employees.phoneNumber": "Phone Number",
	"employees.work": "Work",
	"employees.startTime": "Start time",
	"employees.endTime": "End time",
	"employees.position": "Position",
	"employees.select.location": "Select Location"
}
